{"format": "command-rule.v1", "canonical": "ensurepip", "names": ["ensurepip"], "scope": {"kind": "runtime", "repo": "swe-rebench:tobymao/sqlglot", "runtime_id": "study-source", "entry": "ensurepip"}, "origin": {"kind": "llm", "source": "cube-sandbox-builder:ubuntu2004", "revision": "e4790f0d0956220715844e731dd19c127c4c3523957dc32fbf44a14fc20bcd19", "evidence": ["a3146e2c1723794a99589159870202cc714b42b268610f40402d44a52f3d0ba3"]}, "grammar": {"options": [{"names": ["-h", "--help"], "canonical": "--help", "min": 0, "max": 1, "forms": ["separate"], "optional_value": "next", "dash_values": "any", "repeat": "last"}, {"names": ["--version"], "canonical": "--version", "min": 0, "max": 1, "forms": ["separate"], "optional_value": "next", "dash_values": "any", "repeat": "last"}, {"names": ["-v", "--verbose"], "canonical": "--verbose", "min": 0, "max": 3, "forms": ["separate"], "optional_value": "next", "dash_values": "any", "repeat": "count"}, {"names": ["-U", "--upgrade"], "canonical": "--upgrade", "min": 0, "max": 1, "forms": ["separate"], "optional_value": "next", "dash_values": "any", "repeat": "last"}, {"names": ["--user"], "canonical": "--user", "min": 0, "max": 1, "forms": ["separate"], "optional_value": "next", "dash_values": "any", "repeat": "last"}, {"names": ["--root"], "canonical": "--root", "min": 0, "max": 1, "forms": ["separate"], "optional_value": "next", "dash_values": "any", "repeat": "last"}, {"names": ["--altinstall"], "canonical": "--altinstall", "min": 0, "max": 1, "forms": ["separate"], "optional_value": "next", "dash_values": "any", "repeat": "last"}, {"names": ["--default-pip"], "canonical": "--default-pip", "min": 0, "max": 1, "forms": ["separate"], "optional_value": "next", "dash_values": "any", "repeat": "last"}], "positionals": [], "subcommands": [], "syntax": {"clusters": false, "intermixed": true, "assignments": false}}, "fixtures": [{"argv": ["python3", "-m", "ensurepip", "--version"], "status": "complete", "target": ["ensurepip"]}, {"argv": ["python3", "-m", "ensurepip", "-v", "-v", "-v"], "status": "complete", "target": ["ensurepip"]}, {"argv": ["python3", "-m", "ensurepip", "--root", "/tmp/root", "--user"], "status": "complete", "target": ["ensurepip"]}]}
