{
  "format": "command-rule.v1",
  "canonical": "sed",
  "names": [
    "sed"
  ],
  "scope": {
    "kind": "global"
  },
  "origin": {
    "kind": "fig",
    "source": "https://github.com/withfig/autocomplete/blob/aef52acff84c45edde61ae610cc2c964802b9a38/src/sed.ts",
    "revision": "aef52acff84c45edde61ae610cc2c964802b9a38",
    "evidence": [
      "overrides/sed.json"
    ]
  },
  "grammar": {
    "options": [
      {
        "names": [
          "-E"
        ],
        "canonical": "-E",
        "min": 0,
        "max": 0,
        "forms": [
          "separate",
          "equals",
          "attached"
        ],
        "optional_value": "attached",
        "dash_values": "attached",
        "repeat": "ordered",
        "independent": false,
        "persistent": false
      },
      {
        "names": [
          "-a"
        ],
        "canonical": "-a",
        "min": 0,
        "max": 0,
        "forms": [
          "separate",
          "equals",
          "attached"
        ],
        "optional_value": "attached",
        "dash_values": "attached",
        "repeat": "ordered",
        "independent": false,
        "persistent": false
      },
      {
        "names": [
          "-e",
          "--expression"
        ],
        "canonical": "--expression",
        "min": 1,
        "max": 1,
        "forms": [
          "separate",
          "equals",
          "attached"
        ],
        "optional_value": "attached",
        "dash_values": "attached",
        "repeat": "ordered",
        "independent": true,
        "persistent": false
      },
      {
        "names": [
          "-f",
          "--file"
        ],
        "canonical": "--file",
        "min": 1,
        "max": 1,
        "forms": [
          "separate",
          "equals",
          "attached"
        ],
        "optional_value": "attached",
        "dash_values": "attached",
        "repeat": "ordered",
        "independent": true,
        "persistent": false
      },
      {
        "names": [
          "-I"
        ],
        "canonical": "-I",
        "min": 1,
        "max": 1,
        "forms": [
          "separate",
          "equals",
          "attached"
        ],
        "optional_value": "attached",
        "dash_values": "attached",
        "repeat": "ordered",
        "independent": false,
        "persistent": false
      },
      {
        "names": [
          "-i",
          "--in-place"
        ],
        "canonical": "--in-place",
        "min": 0,
        "max": 1,
        "forms": [
          "separate",
          "equals",
          "attached"
        ],
        "optional_value": "attached",
        "dash_values": "attached",
        "repeat": "ordered",
        "independent": true,
        "persistent": false
      },
      {
        "names": [
          "-l"
        ],
        "canonical": "-l",
        "min": 0,
        "max": 0,
        "forms": [
          "separate",
          "equals",
          "attached"
        ],
        "optional_value": "attached",
        "dash_values": "attached",
        "repeat": "ordered",
        "independent": false,
        "persistent": false
      },
      {
        "names": [
          "-n",
          "--quiet",
          "--silent"
        ],
        "canonical": "--quiet",
        "min": 0,
        "max": 0,
        "forms": [
          "separate",
          "equals",
          "attached"
        ],
        "optional_value": "attached",
        "dash_values": "attached",
        "repeat": "ordered",
        "independent": true,
        "persistent": false
      },
      {
        "names": [
          "-r"
        ],
        "canonical": "-r",
        "min": 0,
        "max": 0,
        "forms": [
          "separate",
          "equals",
          "attached"
        ],
        "optional_value": "attached",
        "dash_values": "attached",
        "repeat": "ordered",
        "independent": false,
        "persistent": false
      },
      {
        "names": [
          "-u"
        ],
        "canonical": "-u",
        "min": 0,
        "max": 0,
        "forms": [
          "separate",
          "equals",
          "attached"
        ],
        "optional_value": "attached",
        "dash_values": "attached",
        "repeat": "ordered",
        "independent": true,
        "persistent": false
      }
    ],
    "positionals": [
      {
        "role": "operand",
        "min": 1,
        "max": 1,
        "skip_if_options": [
          "-e",
          "--expression",
          "-f",
          "--file"
        ]
      },
      {
        "role": "operand",
        "min": 0,
        "max": null
      }
    ],
    "subcommands": [],
    "syntax": {
      "clusters": true,
      "intermixed": true,
      "assignments": false
    },
    "partial": []
  }
}
