{"format": "command-rule.v1", "canonical": "apt-get", "names": ["apt-get"], "scope": {"kind": "runtime", "repo": "swe-rebench:tobymao/sqlglot", "runtime_id": "study-source", "entry": "apt-get"}, "origin": {"kind": "llm", "source": "cube-sandbox-builder:ubuntu2004", "revision": "2a42c0a841cdf71cab90f8b97dd11e482f9e8fc3fb60fb11612fa0bbc3436a6a", "evidence": ["45863d1840cf25a1a0e2057a3cb22283b02bb7c61cf75ae2c12a14e2cf3284cc"]}, "grammar": {"options": [], "positionals": [], "subcommands": [{"names": ["update"], "canonical": "update", "grammar": {"options": [], "positionals": [], "subcommands": [], "syntax": {"clusters": false, "intermixed": false, "assignments": false}}}, {"names": ["upgrade"], "canonical": "upgrade", "grammar": {"options": [], "positionals": [], "subcommands": [], "syntax": {"clusters": false, "intermixed": false, "assignments": false}}}, {"names": ["install"], "canonical": "install", "grammar": {"options": [], "positionals": [{"min": 1, "max": null, "role": "operand"}], "subcommands": [], "syntax": {"clusters": false, "intermixed": false, "assignments": false}}}, {"names": ["reinstall"], "canonical": "reinstall", "grammar": {"options": [], "positionals": [{"min": 1, "max": null, "role": "operand"}], "subcommands": [], "syntax": {"clusters": false, "intermixed": false, "assignments": false}}}, {"names": ["remove"], "canonical": "remove", "grammar": {"options": [], "positionals": [{"min": 1, "max": null, "role": "operand"}], "subcommands": [], "syntax": {"clusters": false, "intermixed": false, "assignments": false}}}, {"names": ["purge"], "canonical": "purge", "grammar": {"options": [], "positionals": [{"min": 1, "max": null, "role": "operand"}], "subcommands": [], "syntax": {"clusters": false, "intermixed": false, "assignments": false}}}, {"names": ["autoremove"], "canonical": "autoremove", "grammar": {"options": [], "positionals": [], "subcommands": [], "syntax": {"clusters": false, "intermixed": false, "assignments": false}}}, {"names": ["dist-upgrade"], "canonical": "dist-upgrade", "grammar": {"options": [], "positionals": [], "subcommands": [], "syntax": {"clusters": false, "intermixed": false, "assignments": false}}}, {"names": ["dselect-upgrade"], "canonical": "dselect-upgrade", "grammar": {"options": [], "positionals": [], "subcommands": [], "syntax": {"clusters": false, "intermixed": false, "assignments": false}}}, {"names": ["build-dep"], "canonical": "build-dep", "grammar": {"options": [], "positionals": [{"min": 1, "max": null, "role": "operand"}], "subcommands": [], "syntax": {"clusters": false, "intermixed": false, "assignments": false}}}, {"names": ["satisfy"], "canonical": "satisfy", "grammar": {"options": [], "positionals": [{"min": 1, "max": null, "role": "operand"}], "subcommands": [], "syntax": {"clusters": false, "intermixed": false, "assignments": false}}}, {"names": ["clean"], "canonical": "clean", "grammar": {"options": [], "positionals": [], "subcommands": [], "syntax": {"clusters": false, "intermixed": false, "assignments": false}}}, {"names": ["autoclean"], "canonical": "autoclean", "grammar": {"options": [], "positionals": [], "subcommands": [], "syntax": {"clusters": false, "intermixed": false, "assignments": false}}}, {"names": ["check"], "canonical": "check", "grammar": {"options": [], "positionals": [], "subcommands": [], "syntax": {"clusters": false, "intermixed": false, "assignments": false}}}, {"names": ["source"], "canonical": "source", "grammar": {"options": [], "positionals": [{"min": 1, "max": null, "role": "operand"}], "subcommands": [], "syntax": {"clusters": false, "intermixed": false, "assignments": false}}}, {"names": ["download"], "canonical": "download", "grammar": {"options": [], "positionals": [{"min": 1, "max": null, "role": "operand"}], "subcommands": [], "syntax": {"clusters": false, "intermixed": false, "assignments": false}}}, {"names": ["changelog"], "canonical": "changelog", "grammar": {"options": [], "positionals": [{"min": 1, "max": null, "role": "operand"}], "subcommands": [], "syntax": {"clusters": false, "intermixed": false, "assignments": false}}}], "syntax": {"clusters": false, "intermixed": false, "assignments": false}}, "fixtures": [{"argv": ["apt-get", "update"], "status": "complete", "target": ["update"]}]}
