{
  "format": "command-rule.v1",
  "canonical": "nice",
  "names": [
    "nice"
  ],
  "scope": {
    "kind": "global"
  },
  "origin": {
    "kind": "curated",
    "source": "https://www.gnu.org/software/manual/",
    "revision": "gnu-linux-initial",
    "evidence": [
      "overrides/nice.json"
    ]
  },
  "grammar": {
    "options": [
      {
        "names": [
          "-n",
          "--adjustment"
        ],
        "canonical": "--adjustment",
        "min": 1,
        "max": 1,
        "forms": [
          "separate",
          "attached",
          "equals"
        ],
        "optional_value": "attached",
        "dash_values": "attached",
        "repeat": "ordered",
        "independent": true
      }
    ],
    "positionals": [
      {
        "role": "command_tail",
        "min": 1,
        "max": 1
      }
    ],
    "subcommands": [],
    "syntax": {
      "clusters": true,
      "intermixed": true,
      "assignments": false
    }
  }
}
